{
  "schema_version": "1.0.0",
  "session_id": "replace-with-session-id",
  "revision": 0,
  "profile": {
    "grade": "초6",
    "subject": "사회",
    "unit": "",
    "interests": ["평범한 사람의 생활"]
  },
  "gate": {
    "state": "COLLECT_PROFILE",
    "start_token": "[시작]",
    "start_confirmed": false,
    "start_armed_revision": null,
    "start_consumed_revision": null
  },
  "research": {
    "plan": {
      "id": "RES-NOT-STARTED",
      "subject_domains": ["INTERDISCIPLINARY"],
      "candidate_modes": ["INTERDISCIPLINARY_PROJECT"],
      "essential_question": "학생 프로필 수집 후 결정한다.",
      "freshness": "CHECK_THIS_SESSION",
      "risk": "LOW",
      "claim_candidates": ["학생 프로필 수집 후 핵심 주장 후보를 만든다."],
      "claim_quality_gates": [
        {
          "claim": "학생 프로필 수집 후 핵심 주장 후보를 만든다.",
          "risk": "LOW",
          "minimum_independent_sources": 1,
          "minimum_tier_a_sources": 0,
          "evidence_ids": [],
          "exception_reason": null
        }
      ],
      "required_source_classes": ["교과 분류 후 결정"],
      "search_queries": ["학생 프로필 수집 후 결정"],
      "readiness": "NEEDS_RESEARCH"
    },
    "readiness_checked": false,
    "gaps": ["학생 프로필과 조사 자료가 아직 없다."]
  },
  "lesson": {
    "scenario_id": "not-selected",
    "title": "선택 전",
    "subject_domains": ["INTERDISCIPLINARY"],
    "lesson_mode": "INTERDISCIPLINARY_PROJECT",
    "premise": "조사와 선택 전",
    "research_id": "RES-NOT-STARTED",
    "objectives": ["사실과 가정을 구분한다"],
    "sensitivity": "LOW"
  },
  "sources": [],
  "evidence": [],
  "memory": {
    "canon": [],
    "current_state": {
      "time": "시작 전",
      "place": "미정",
      "role": "미정",
      "constraints": []
    },
    "negative_facts": [],
    "corrections": [],
    "open_threads": [],
    "episode_archive": [],
    "conflicts": [],
    "discarded_detail_summary": [],
    "compaction": {
      "sequence": 0,
      "source_revision": 0,
      "source_sha256": ""
    }
  }
}
